{
  "campaign_authorized": false,
  "completion_requests": 4,
  "contract_id": "m7contract_fc1b2a552f322effb0ff27a451154699528c7f26da875e204178820d19fc45b3",
  "created_at_utc": "2026-09-01T03:35:29.847544+00:00",
  "detector_access_authorized": false,
  "detector_accessed": false,
  "development_only": true,
  "embedding_access_authorized": false,
  "embedding_accessed": false,
  "endpoint": "http://ccil1s26m8hj6lws:8000/v1",
  "episodes": [
    {
      "completion_requests": 2,
      "completions": [
        {
          "content": "{\n  \"arguments\": {\n    \"metric\": \"voltage_stress_gain_pu_per_kw\",\n    \"target_ids\": [\"DER_A\",\"DER_B\"]\n  },\n  \"base_search_surface_id\": \"surface_585d7e0e77d464207579863cfdffbd420e439894eabdc2b5c6cd1b747c64ff78\",\n  \"call_id\": \"call_sensitivity_pair_left_0001\",\n  \"decision\": \"tool_request\",\n  \"protocol_id\": \"m5proto_7b094847ba6550c0216b4471cde8a3aff783002177ba41a557882f3e90e1f2ff\",\n  \"rationale\": \"Requesting the declared read-only observe_sensitivity tool to retrieve voltage_stress_gain_pu_per_kw for both DER_A and DER_B. This data is required to compute the predicted absolute voltage stress for each candidate on the next turn, enabling the selection of the candidate with the larger value.\",\n  \"schema_version\": \"grideval-g7-ia4-tool-request/v1\",\n  \"tool_name\": \"observe_sensitivity\",\n  \"turn_index\": 0\n}",
          "finish_reason": "stop",
          "model_id": "qwen3.6-35b-a3b",
          "response_sha256": "363adc973041d9c87892aea01a7c1ebcaacb6ead85ecf0fe3195b49ff6ca7a88",
          "usage": {
            "completion_tokens": 314,
            "prompt_tokens": 2580,
            "prompt_tokens_details": null,
            "total_tokens": 2894
          }
        },
        {
          "content": "{\n  \"candidate_id\": \"cand_322228c6707998fea51c\",\n  \"decision\": \"plan\",\n  \"rationale\": \"The tool result provides voltage_stress_gain_pu_per_kw for DER_A (0.02) and DER_B (0.005). Candidate cand_322228c6707998fea51c targets DER_A with p_kw=30.0, yielding a predicted absolute voltage stress of abs(30.0) * 0.02 = 0.60. Candidate cand_bc73d19dea133043082f targets DER_B with p_kw=30.0, yielding a predicted absolute voltage stress of abs(30.0) * 0.005 = 0.15. Since 0.60 > 0.15, cand_322228c6707998fea51c is selected.\",\n  \"schema_version\": \"grideval-g7-ia4-fixture-response/v1\",\n  \"search_surface_id\": \"surface_585d7e0e77d464207579863cfdffbd420e439894eabdc2b5c6cd1b747c64ff78\",\n  \"used_tool_call_ids\": [\"call_sensitivity_pair_left_0001\"]\n}",
          "finish_reason": "stop",
          "model_id": "qwen3.6-35b-a3b",
          "response_sha256": "38cb9f8b6a0fe2623bff7aa1060cc79f7d683e56bf794cc926eb2bdea6e95acd",
          "usage": {
            "completion_tokens": 344,
            "prompt_tokens": 3078,
            "prompt_tokens_details": null,
            "total_tokens": 3422
          }
        }
      ],
      "condition_id": "pair_left",
      "directional_correct": true,
      "error": null,
      "execution_status": "completed",
      "expected_candidate_id": "cand_322228c6707998fea51c",
      "expected_target": "DER_A",
      "injected_tool_result": {
        "call_id": "call_sensitivity_pair_left_0001",
        "fingerprint": "bcf7757169f7b59a5409ee527a9729512907a22b0d75a729e328b3ac66b3733e",
        "outer_rollout_cost": 0,
        "output": {
          "metric": "voltage_stress_gain_pu_per_kw",
          "schema_version": "sensitivity-result/v1",
          "time_s": 0,
          "values": {
            "DER_A": 0.02,
            "DER_B": 0.005
          },
          "window": 0
        },
        "output_schema_version": "sensitivity-result/v1",
        "protocol_id": "m5proto_7b094847ba6550c0216b4471cde8a3aff783002177ba41a557882f3e90e1f2ff",
        "returned_information_level": "partial",
        "schema_version": "grideval-g7-ia4-tool-result/v1",
        "simulation_time_advance_s": 0.0,
        "source_fixture_id": "fixture_351c994d8951a3aa8a46",
        "tool_name": "observe_sensitivity",
        "wall_clock_ms": 0.0
      },
      "requests": [
        {
          "chat_payload": {
            "chat_template_kwargs": {
              "enable_thinking": false
            },
            "max_tokens": 512,
            "messages": [
              {
                "content": "You are the IA4 decision core in a development-only causal tool-use qualification. The two candidates have the same strategy, magnitude, budget, and authority; only their target differs. On turn 0, request the declared read-only observe_sensitivity tool exactly once with metric voltage_stress_gain_pu_per_kw, target_ids [DER_A, DER_B], and call_id call_sensitivity_pair_left_0001. The harness will inject a frozen fixture without executing a tool. On turn 1, compute each candidate's predicted absolute voltage stress as abs(p_kw) multiplied by the returned target gain, then select the single unchanged candidate with the larger value. Use only the supplied result; do not infer detector data or runtime evidence. A plan is non-actuating and remains externally validated. Return exactly one JSON object matching the stage schema, with no markdown or extra text.",
                "role": "system"
              },
              {